{
  "schema_version": "1.0",
  "engine_version": "c3-0.1.0",
  "input": {
    "user_ref": "u_8c53e7b89615",
    "post_ids": [
      "D12_b01",
      "D12_b02",
      "D12_b04",
      "D12_b09",
      "D12_b13",
      "D12_b17",
      "D12_b23",
      "D12_b27",
      "D12_b28",
      "D12_b30"
    ],
    "method": "loo"
  },
  "output": {
    "baseline_risk": 49.29,
    "residual_risk": 0.0,
    "risk_after": null,
    "contributions": [
      {
        "post_id": "D12_b04",
        "risk_without": 35.0,
        "delta": -14.29,
        "rank": 1,
        "clue_ids": [
          "D12_b04_s01",
          "D12_b04_s02"
        ],
        "top_spans": [
          {
            "span_id": "D12_b04_s01",
            "text_id": "title"
          },
          {
            "span_id": "D12_b04_s02",
            "text_id": "body"
          }
        ]
      },
      {
        "post_id": "D12_b09",
        "risk_without": 40.71,
        "delta": -8.57,
        "rank": 2,
        "clue_ids": [
          "D12_b09_s01",
          "D12_b09_s02"
        ],
        "top_spans": [
          {
            "span_id": "D12_b09_s01",
            "text_id": "body"
          },
          {
            "span_id": "D12_b09_s02",
            "text_id": "body"
          }
        ]
      },
      {
        "post_id": "D12_b23",
        "risk_without": 41.43,
        "delta": -7.86,
        "rank": 3,
        "clue_ids": [
          "D12_b23_s01"
        ],
        "top_spans": [
          {
            "span_id": "D12_b23_s01",
            "text_id": "body"
          }
        ]
      },
      {
        "post_id": "D12_b13",
        "risk_without": 42.14,
        "delta": -7.14,
        "rank": 4,
        "clue_ids": [
          "D12_b13_s01"
        ],
        "top_spans": [
          {
            "span_id": "D12_b13_s01",
            "text_id": "body"
          }
        ]
      },
      {
        "post_id": "D12_b01",
        "risk_without": 49.29,
        "delta": 0.0,
        "rank": 5,
        "clue_ids": [
          "D12_b01_s01",
          "D12_b01_s02"
        ],
        "top_spans": [
          {
            "span_id": "D12_b01_s01",
            "text_id": "title"
          },
          {
            "span_id": "D12_b01_s02",
            "text_id": "body"
          }
        ]
      },
      {
        "post_id": "D12_b02",
        "risk_without": 49.29,
        "delta": 0.0,
        "rank": 6,
        "clue_ids": [],
        "top_spans": []
      },
      {
        "post_id": "D12_b17",
        "risk_without": 49.29,
        "delta": 0.0,
        "rank": 7,
        "clue_ids": [
          "D12_b17_s01",
          "D12_b17_s02"
        ],
        "top_spans": [
          {
            "span_id": "D12_b17_s01",
            "text_id": "body"
          },
          {
            "span_id": "D12_b17_s02",
            "text_id": "body"
          }
        ]
      },
      {
        "post_id": "D12_b27",
        "risk_without": 49.29,
        "delta": 0.0,
        "rank": 8,
        "clue_ids": [
          "D12_b27_s01",
          "D12_b27_s02"
        ],
        "top_spans": [
          {
            "span_id": "D12_b27_s01",
            "text_id": "title"
          },
          {
            "span_id": "D12_b27_s02",
            "text_id": "body"
          }
        ]
      },
      {
        "post_id": "D12_b28",
        "risk_without": 49.29,
        "delta": 0.0,
        "rank": 9,
        "clue_ids": [
          "D12_b28_s01",
          "D12_b28_s02",
          "D12_b28_s03"
        ],
        "top_spans": [
          {
            "span_id": "D12_b28_s01",
            "text_id": "body"
          },
          {
            "span_id": "D12_b28_s02",
            "text_id": "body"
          },
          {
            "span_id": "D12_b28_s03",
            "text_id": "body"
          }
        ]
      },
      {
        "post_id": "D12_b30",
        "risk_without": 49.29,
        "delta": 0.0,
        "rank": 10,
        "clue_ids": [
          "D12_b30_s01"
        ],
        "top_spans": [
          {
            "span_id": "D12_b30_s01",
            "text_id": "body"
          }
        ]
      }
    ],
    "user_scoped": [],
    "greedy_path": [
      {
        "remove": "D12_b04",
        "risk_after": 35.0
      },
      {
        "remove": "D12_b09",
        "risk_after": 26.43
      },
      {
        "remove": "D12_b23",
        "risk_after": 18.57
      },
      {
        "remove": "D12_b13",
        "risk_after": 11.43
      }
    ],
    "approx_error": null,
    "note": "greedy_path는 매 제거 후 위험도를 재계산한 값이므로 delta 상위 n개의 단순 합과 일치하지 않을 수 있다."
  }
}
