{
  "schema_version": "1.0",
  "engine_version": "c3-0.1.0",
  "input": {
    "user_ref": "u_7f4ad165faba",
    "post_ids": [
      "B13_b02",
      "B13_b07",
      "B13_b15",
      "B13_b21",
      "B13_b28",
      "B13_b30"
    ],
    "method": "loo"
  },
  "output": {
    "baseline_risk": 27.86,
    "residual_risk": 0.0,
    "risk_after": null,
    "contributions": [
      {
        "post_id": "B13_b30",
        "risk_without": 22.14,
        "delta": -5.71,
        "rank": 1,
        "clue_ids": [
          "B13_b30_s01"
        ],
        "top_spans": [
          {
            "span_id": "B13_b30_s01",
            "text_id": "body"
          }
        ]
      },
      {
        "post_id": "B13_b02",
        "risk_without": 27.86,
        "delta": 0.0,
        "rank": 2,
        "clue_ids": [
          "B13_b02_s01"
        ],
        "top_spans": [
          {
            "span_id": "B13_b02_s01",
            "text_id": "body"
          }
        ]
      },
      {
        "post_id": "B13_b07",
        "risk_without": 27.86,
        "delta": 0.0,
        "rank": 3,
        "clue_ids": [
          "B13_b07_s01",
          "B13_b07_s02",
          "B13_b07_s03",
          "B13_b07_s04"
        ],
        "top_spans": [
          {
            "span_id": "B13_b07_s01",
            "text_id": "body"
          },
          {
            "span_id": "B13_b07_s02",
            "text_id": "body"
          },
          {
            "span_id": "B13_b07_s03",
            "text_id": "body"
          }
        ]
      },
      {
        "post_id": "B13_b15",
        "risk_without": 27.86,
        "delta": 0.0,
        "rank": 4,
        "clue_ids": [
          "B13_b15_s01"
        ],
        "top_spans": [
          {
            "span_id": "B13_b15_s01",
            "text_id": "body"
          }
        ]
      },
      {
        "post_id": "B13_b21",
        "risk_without": 27.86,
        "delta": 0.0,
        "rank": 5,
        "clue_ids": [
          "B13_b21_s01",
          "B13_b21_s02",
          "B13_b21_s03"
        ],
        "top_spans": [
          {
            "span_id": "B13_b21_s01",
            "text_id": "body"
          },
          {
            "span_id": "B13_b21_s02",
            "text_id": "body"
          },
          {
            "span_id": "B13_b21_s03",
            "text_id": "body"
          }
        ]
      },
      {
        "post_id": "B13_b28",
        "risk_without": 27.86,
        "delta": 0.0,
        "rank": 6,
        "clue_ids": [
          "B13_b28_s01",
          "B13_b28_s02",
          "B13_b28_s03"
        ],
        "top_spans": [
          {
            "span_id": "B13_b28_s01",
            "text_id": "body"
          },
          {
            "span_id": "B13_b28_s02",
            "text_id": "body"
          },
          {
            "span_id": "B13_b28_s03",
            "text_id": "body"
          }
        ]
      }
    ],
    "user_scoped": [],
    "greedy_path": [
      {
        "remove": "B13_b30",
        "risk_after": 22.14
      }
    ],
    "approx_error": null,
    "note": "greedy_path는 매 제거 후 위험도를 재계산한 값이므로 delta 상위 n개의 단순 합과 일치하지 않을 수 있다."
  }
}
