{
  "schema_version": "1.0",
  "engine_version": "c3-0.1.0",
  "input": {
    "user_ref": "u_91bec90d2f59",
    "post_ids": [
      "A12_b17",
      "A12_b21"
    ],
    "method": "loo"
  },
  "output": {
    "baseline_risk": 20.71,
    "residual_risk": 0.0,
    "risk_after": null,
    "contributions": [
      {
        "post_id": "A12_b17",
        "risk_without": 7.14,
        "delta": -13.57,
        "rank": 1,
        "clue_ids": [
          "A12_b17_s01",
          "A12_b17_s02",
          "A12_b17_s03"
        ],
        "top_spans": [
          {
            "span_id": "A12_b17_s01",
            "text_id": "body"
          },
          {
            "span_id": "A12_b17_s02",
            "text_id": "body"
          },
          {
            "span_id": "A12_b17_s03",
            "text_id": "body"
          }
        ]
      },
      {
        "post_id": "A12_b21",
        "risk_without": 13.57,
        "delta": -7.14,
        "rank": 2,
        "clue_ids": [
          "A12_b21_s01"
        ],
        "top_spans": [
          {
            "span_id": "A12_b21_s01",
            "text_id": "body"
          }
        ]
      }
    ],
    "user_scoped": [],
    "greedy_path": [
      {
        "remove": "A12_b17",
        "risk_after": 7.14
      },
      {
        "remove": "A12_b21",
        "risk_after": 0.0
      }
    ],
    "approx_error": null,
    "note": "greedy_path는 매 제거 후 위험도를 재계산한 값이므로 delta 상위 n개의 단순 합과 일치하지 않을 수 있다."
  }
}
