{
  "schema_version": "1.0",
  "engine_version": "c3-0.1.0",
  "input": {
    "user_ref": "u_334908efbe3f",
    "post_ids": [
      "E10_b01",
      "E10_b04",
      "E10_b06",
      "E10_b13",
      "E10_b16",
      "E10_b18",
      "E10_b19",
      "E10_b21",
      "E10_b22",
      "E10_b23",
      "E10_b24",
      "E10_b26",
      "E10_b27",
      "E10_b28",
      "E10_b29",
      "E10_b30"
    ],
    "method": "loo"
  },
  "output": {
    "baseline_risk": 23.57,
    "residual_risk": 0.0,
    "risk_after": null,
    "contributions": [
      {
        "post_id": "E10_b01",
        "risk_without": 23.57,
        "delta": 0.0,
        "rank": 1,
        "clue_ids": [
          "E10_b01_s01"
        ],
        "top_spans": [
          {
            "span_id": "E10_b01_s01",
            "text_id": "body"
          }
        ]
      },
      {
        "post_id": "E10_b04",
        "risk_without": 23.57,
        "delta": 0.0,
        "rank": 2,
        "clue_ids": [
          "E10_b04_s01"
        ],
        "top_spans": [
          {
            "span_id": "E10_b04_s01",
            "text_id": "body"
          }
        ]
      },
      {
        "post_id": "E10_b06",
        "risk_without": 23.57,
        "delta": 0.0,
        "rank": 3,
        "clue_ids": [
          "E10_b06_s01",
          "E10_b06_s02",
          "E10_b06_s03",
          "E10_b06_s04"
        ],
        "top_spans": [
          {
            "span_id": "E10_b06_s01",
            "text_id": "title"
          },
          {
            "span_id": "E10_b06_s02",
            "text_id": "body"
          },
          {
            "span_id": "E10_b06_s03",
            "text_id": "body"
          }
        ]
      },
      {
        "post_id": "E10_b13",
        "risk_without": 23.57,
        "delta": 0.0,
        "rank": 4,
        "clue_ids": [
          "E10_b13_s01"
        ],
        "top_spans": [
          {
            "span_id": "E10_b13_s01",
            "text_id": "body"
          }
        ]
      },
      {
        "post_id": "E10_b16",
        "risk_without": 23.57,
        "delta": 0.0,
        "rank": 5,
        "clue_ids": [
          "E10_b16_s01",
          "E10_b16_s02",
          "E10_b16_s03",
          "E10_b16_s04"
        ],
        "top_spans": [
          {
            "span_id": "E10_b16_s01",
            "text_id": "title"
          },
          {
            "span_id": "E10_b16_s02",
            "text_id": "body"
          },
          {
            "span_id": "E10_b16_s03",
            "text_id": "body"
          }
        ]
      },
      {
        "post_id": "E10_b18",
        "risk_without": 23.57,
        "delta": 0.0,
        "rank": 6,
        "clue_ids": [
          "E10_b18_s01",
          "E10_b18_s02",
          "E10_b18_s03"
        ],
        "top_spans": [
          {
            "span_id": "E10_b18_s01",
            "text_id": "body"
          },
          {
            "span_id": "E10_b18_s02",
            "text_id": "body"
          },
          {
            "span_id": "E10_b18_s03",
            "text_id": "body"
          }
        ]
      },
      {
        "post_id": "E10_b19",
        "risk_without": 23.57,
        "delta": 0.0,
        "rank": 7,
        "clue_ids": [
          "E10_b19_s01"
        ],
        "top_spans": [
          {
            "span_id": "E10_b19_s01",
            "text_id": "body"
          }
        ]
      },
      {
        "post_id": "E10_b21",
        "risk_without": 23.57,
        "delta": 0.0,
        "rank": 8,
        "clue_ids": [
          "E10_b21_s01",
          "E10_b21_s02",
          "E10_b21_s03",
          "E10_b21_s04"
        ],
        "top_spans": [
          {
            "span_id": "E10_b21_s01",
            "text_id": "title"
          },
          {
            "span_id": "E10_b21_s02",
            "text_id": "title"
          },
          {
            "span_id": "E10_b21_s03",
            "text_id": "body"
          }
        ]
      },
      {
        "post_id": "E10_b22",
        "risk_without": 23.57,
        "delta": 0.0,
        "rank": 9,
        "clue_ids": [
          "E10_b22_s01"
        ],
        "top_spans": [
          {
            "span_id": "E10_b22_s01",
            "text_id": "body"
          }
        ]
      },
      {
        "post_id": "E10_b23",
        "risk_without": 23.57,
        "delta": 0.0,
        "rank": 10,
        "clue_ids": [
          "E10_b23_s01",
          "E10_b23_s02"
        ],
        "top_spans": [
          {
            "span_id": "E10_b23_s01",
            "text_id": "body"
          },
          {
            "span_id": "E10_b23_s02",
            "text_id": "body"
          }
        ]
      },
      {
        "post_id": "E10_b24",
        "risk_without": 23.57,
        "delta": 0.0,
        "rank": 11,
        "clue_ids": [
          "E10_b24_s01",
          "E10_b24_s02"
        ],
        "top_spans": [
          {
            "span_id": "E10_b24_s01",
            "text_id": "body"
          },
          {
            "span_id": "E10_b24_s02",
            "text_id": "body"
          }
        ]
      },
      {
        "post_id": "E10_b26",
        "risk_without": 23.57,
        "delta": 0.0,
        "rank": 12,
        "clue_ids": [
          "E10_b26_s01",
          "E10_b26_s02"
        ],
        "top_spans": [
          {
            "span_id": "E10_b26_s01",
            "text_id": "body"
          },
          {
            "span_id": "E10_b26_s02",
            "text_id": "body"
          }
        ]
      },
      {
        "post_id": "E10_b27",
        "risk_without": 23.57,
        "delta": 0.0,
        "rank": 13,
        "clue_ids": [
          "E10_b27_s01"
        ],
        "top_spans": [
          {
            "span_id": "E10_b27_s01",
            "text_id": "body"
          }
        ]
      },
      {
        "post_id": "E10_b28",
        "risk_without": 23.57,
        "delta": 0.0,
        "rank": 14,
        "clue_ids": [
          "E10_b28_s01"
        ],
        "top_spans": [
          {
            "span_id": "E10_b28_s01",
            "text_id": "body"
          }
        ]
      },
      {
        "post_id": "E10_b29",
        "risk_without": 23.57,
        "delta": 0.0,
        "rank": 15,
        "clue_ids": [
          "E10_b29_s01",
          "E10_b29_s02",
          "E10_b29_s03"
        ],
        "top_spans": [
          {
            "span_id": "E10_b29_s01",
            "text_id": "body"
          },
          {
            "span_id": "E10_b29_s02",
            "text_id": "body"
          },
          {
            "span_id": "E10_b29_s03",
            "text_id": "body"
          }
        ]
      },
      {
        "post_id": "E10_b30",
        "risk_without": 23.57,
        "delta": 0.0,
        "rank": 16,
        "clue_ids": [
          "E10_b30_s01"
        ],
        "top_spans": [
          {
            "span_id": "E10_b30_s01",
            "text_id": "body"
          }
        ]
      }
    ],
    "user_scoped": [],
    "greedy_path": [],
    "approx_error": null,
    "note": "greedy_path는 매 제거 후 위험도를 재계산한 값이므로 delta 상위 n개의 단순 합과 일치하지 않을 수 있다."
  }
}
