{
  "schema_version": "1.0",
  "engine_version": "c3-0.1.0",
  "input": {
    "user_ref": "u_5985f6f8353e",
    "post_ids": [
      "A18_b01",
      "A18_b07",
      "A18_b08",
      "A18_b15",
      "A18_b18",
      "A18_b21",
      "A18_b22",
      "A18_b23",
      "A18_b25",
      "A18_b30"
    ],
    "method": "loo"
  },
  "output": {
    "baseline_risk": 20.0,
    "residual_risk": 0.0,
    "risk_after": null,
    "contributions": [
      {
        "post_id": "A18_b01",
        "risk_without": 20.0,
        "delta": 0.0,
        "rank": 1,
        "clue_ids": [
          "A18_b01_s01",
          "A18_b01_s02"
        ],
        "top_spans": [
          {
            "span_id": "A18_b01_s01",
            "text_id": "body"
          },
          {
            "span_id": "A18_b01_s02",
            "text_id": "body"
          }
        ]
      },
      {
        "post_id": "A18_b07",
        "risk_without": 20.0,
        "delta": 0.0,
        "rank": 2,
        "clue_ids": [
          "A18_b07_s01",
          "A18_b07_s02"
        ],
        "top_spans": [
          {
            "span_id": "A18_b07_s01",
            "text_id": "body"
          },
          {
            "span_id": "A18_b07_s02",
            "text_id": "body"
          }
        ]
      },
      {
        "post_id": "A18_b08",
        "risk_without": 20.0,
        "delta": 0.0,
        "rank": 3,
        "clue_ids": [
          "A18_b08_s01",
          "A18_b08_s02"
        ],
        "top_spans": [
          {
            "span_id": "A18_b08_s01",
            "text_id": "body"
          },
          {
            "span_id": "A18_b08_s02",
            "text_id": "body"
          }
        ]
      },
      {
        "post_id": "A18_b15",
        "risk_without": 20.0,
        "delta": 0.0,
        "rank": 4,
        "clue_ids": [
          "A18_b15_s01",
          "A18_b15_s02",
          "A18_b15_s03"
        ],
        "top_spans": [
          {
            "span_id": "A18_b15_s01",
            "text_id": "body"
          },
          {
            "span_id": "A18_b15_s02",
            "text_id": "body"
          },
          {
            "span_id": "A18_b15_s03",
            "text_id": "body"
          }
        ]
      },
      {
        "post_id": "A18_b18",
        "risk_without": 20.0,
        "delta": 0.0,
        "rank": 5,
        "clue_ids": [
          "A18_b18_s01",
          "A18_b18_s02",
          "A18_b18_s03"
        ],
        "top_spans": [
          {
            "span_id": "A18_b18_s01",
            "text_id": "body"
          },
          {
            "span_id": "A18_b18_s02",
            "text_id": "body"
          },
          {
            "span_id": "A18_b18_s03",
            "text_id": "body"
          }
        ]
      },
      {
        "post_id": "A18_b21",
        "risk_without": 20.0,
        "delta": 0.0,
        "rank": 6,
        "clue_ids": [
          "A18_b21_s01",
          "A18_b21_s02"
        ],
        "top_spans": [
          {
            "span_id": "A18_b21_s01",
            "text_id": "title"
          },
          {
            "span_id": "A18_b21_s02",
            "text_id": "body"
          }
        ]
      },
      {
        "post_id": "A18_b22",
        "risk_without": 20.0,
        "delta": 0.0,
        "rank": 7,
        "clue_ids": [
          "A18_b22_s01",
          "A18_b22_s02"
        ],
        "top_spans": [
          {
            "span_id": "A18_b22_s01",
            "text_id": "body"
          },
          {
            "span_id": "A18_b22_s02",
            "text_id": "body"
          }
        ]
      },
      {
        "post_id": "A18_b23",
        "risk_without": 20.0,
        "delta": 0.0,
        "rank": 8,
        "clue_ids": [
          "A18_b23_s01"
        ],
        "top_spans": [
          {
            "span_id": "A18_b23_s01",
            "text_id": "body"
          }
        ]
      },
      {
        "post_id": "A18_b25",
        "risk_without": 20.0,
        "delta": 0.0,
        "rank": 9,
        "clue_ids": [
          "A18_b25_s01"
        ],
        "top_spans": [
          {
            "span_id": "A18_b25_s01",
            "text_id": "body"
          }
        ]
      },
      {
        "post_id": "A18_b30",
        "risk_without": 20.0,
        "delta": 0.0,
        "rank": 10,
        "clue_ids": [
          "A18_b30_s01"
        ],
        "top_spans": [
          {
            "span_id": "A18_b30_s01",
            "text_id": "body"
          }
        ]
      }
    ],
    "user_scoped": [],
    "greedy_path": [],
    "approx_error": null,
    "note": "greedy_path는 매 제거 후 위험도를 재계산한 값이므로 delta 상위 n개의 단순 합과 일치하지 않을 수 있다."
  }
}
