{
  "schema_version": "1.0",
  "engine_version": "c3-0.1.0",
  "input": {
    "user_ref": "u_b6e084c59b2e",
    "post_ids": [
      "B14_b21",
      "B14_b28"
    ],
    "method": "loo"
  },
  "output": {
    "baseline_risk": 16.43,
    "residual_risk": 0.0,
    "risk_after": null,
    "contributions": [
      {
        "post_id": "B14_b21",
        "risk_without": 16.43,
        "delta": 0.0,
        "rank": 1,
        "clue_ids": [
          "B14_b21_s01",
          "B14_b21_s02"
        ],
        "top_spans": [
          {
            "span_id": "B14_b21_s01",
            "text_id": "body"
          },
          {
            "span_id": "B14_b21_s02",
            "text_id": "body"
          }
        ]
      },
      {
        "post_id": "B14_b28",
        "risk_without": 16.43,
        "delta": 0.0,
        "rank": 2,
        "clue_ids": [
          "B14_b28_s01",
          "B14_b28_s02"
        ],
        "top_spans": [
          {
            "span_id": "B14_b28_s01",
            "text_id": "body"
          },
          {
            "span_id": "B14_b28_s02",
            "text_id": "body"
          }
        ]
      }
    ],
    "user_scoped": [],
    "greedy_path": [],
    "approx_error": null,
    "note": "greedy_path는 매 제거 후 위험도를 재계산한 값이므로 delta 상위 n개의 단순 합과 일치하지 않을 수 있다."
  }
}
