{
  "schema_version": "1.0",
  "engine_version": "c3-0.1.0",
  "input": {
    "user_ref": "u_899af38b9adb",
    "post_ids": [
      "A13_b06",
      "A13_b07",
      "A13_b18",
      "A13_b21",
      "A13_b23",
      "A13_b25",
      "A13_b26",
      "A13_b29",
      "A13_b30"
    ],
    "method": "loo"
  },
  "output": {
    "baseline_risk": 15.0,
    "residual_risk": 0.0,
    "risk_after": null,
    "contributions": [
      {
        "post_id": "A13_b25",
        "risk_without": 7.14,
        "delta": -7.86,
        "rank": 1,
        "clue_ids": [
          "A13_b25_s01"
        ],
        "top_spans": [
          {
            "span_id": "A13_b25_s01",
            "text_id": "body"
          }
        ]
      },
      {
        "post_id": "A13_b06",
        "risk_without": 15.0,
        "delta": 0.0,
        "rank": 2,
        "clue_ids": [
          "A13_b06_s01",
          "A13_b06_s02"
        ],
        "top_spans": [
          {
            "span_id": "A13_b06_s01",
            "text_id": "body"
          },
          {
            "span_id": "A13_b06_s02",
            "text_id": "body"
          }
        ]
      },
      {
        "post_id": "A13_b07",
        "risk_without": 15.0,
        "delta": 0.0,
        "rank": 3,
        "clue_ids": [
          "A13_b07_s01"
        ],
        "top_spans": [
          {
            "span_id": "A13_b07_s01",
            "text_id": "title"
          }
        ]
      },
      {
        "post_id": "A13_b18",
        "risk_without": 15.0,
        "delta": 0.0,
        "rank": 4,
        "clue_ids": [
          "A13_b18_s01"
        ],
        "top_spans": [
          {
            "span_id": "A13_b18_s01",
            "text_id": "body"
          }
        ]
      },
      {
        "post_id": "A13_b21",
        "risk_without": 15.0,
        "delta": 0.0,
        "rank": 5,
        "clue_ids": [
          "A13_b21_s01"
        ],
        "top_spans": [
          {
            "span_id": "A13_b21_s01",
            "text_id": "body"
          }
        ]
      },
      {
        "post_id": "A13_b23",
        "risk_without": 15.0,
        "delta": 0.0,
        "rank": 6,
        "clue_ids": [
          "A13_b23_s01"
        ],
        "top_spans": [
          {
            "span_id": "A13_b23_s01",
            "text_id": "title"
          }
        ]
      },
      {
        "post_id": "A13_b26",
        "risk_without": 15.0,
        "delta": 0.0,
        "rank": 7,
        "clue_ids": [
          "A13_b26_s01"
        ],
        "top_spans": [
          {
            "span_id": "A13_b26_s01",
            "text_id": "title"
          }
        ]
      },
      {
        "post_id": "A13_b29",
        "risk_without": 15.0,
        "delta": 0.0,
        "rank": 8,
        "clue_ids": [
          "A13_b29_s01",
          "A13_b29_s02"
        ],
        "top_spans": [
          {
            "span_id": "A13_b29_s01",
            "text_id": "body"
          },
          {
            "span_id": "A13_b29_s02",
            "text_id": "body"
          }
        ]
      },
      {
        "post_id": "A13_b30",
        "risk_without": 15.0,
        "delta": 0.0,
        "rank": 9,
        "clue_ids": [
          "A13_b30_s01"
        ],
        "top_spans": [
          {
            "span_id": "A13_b30_s01",
            "text_id": "title"
          }
        ]
      }
    ],
    "user_scoped": [],
    "greedy_path": [
      {
        "remove": "A13_b25",
        "risk_after": 7.14
      }
    ],
    "approx_error": null,
    "note": "greedy_path는 매 제거 후 위험도를 재계산한 값이므로 delta 상위 n개의 단순 합과 일치하지 않을 수 있다."
  }
}
