{
  "schema_version": "1.0",
  "engine_version": "c3-0.1.0",
  "input": {
    "user_ref": "u_422446d7512f",
    "post_ids": [
      "D20_b22"
    ],
    "method": "loo"
  },
  "output": {
    "baseline_risk": 14.29,
    "residual_risk": 0.0,
    "risk_after": null,
    "contributions": [
      {
        "post_id": "D20_b22",
        "risk_without": 0.0,
        "delta": -14.29,
        "rank": 1,
        "clue_ids": [
          "D20_b22_s01",
          "D20_b22_s02",
          "D20_b22_s03"
        ],
        "top_spans": [
          {
            "span_id": "D20_b22_s01",
            "text_id": "body"
          },
          {
            "span_id": "D20_b22_s02",
            "text_id": "body"
          },
          {
            "span_id": "D20_b22_s03",
            "text_id": "body"
          }
        ]
      }
    ],
    "user_scoped": [],
    "greedy_path": [
      {
        "remove": "D20_b22",
        "risk_after": 0.0
      }
    ],
    "approx_error": null,
    "note": "greedy_path는 매 제거 후 위험도를 재계산한 값이므로 delta 상위 n개의 단순 합과 일치하지 않을 수 있다."
  }
}
